{
  "version": 1,
  "id": "rost-fan",
  "title": "Р.О.С.Т. / диагональный паттерн",
  "source": "Figma RnBHxdFLuCb2eIb6NTBCap, node 2179:1529; spacing matched to rost-fold vertex 28",
  "viewBox": [
    1920,
    793
  ],
  "style": {
    "stroke": "#dd192d",
    "background": "#1a1d24",
    "strokeWidth": 3,
    "opacity": 0.6
  },
  "motion": {
    "mode": "sampled-rows",
    "secondsPerStep": 1.5,
    "fadeIn": 0.65,
    "fadeOut": 0
  },
  "rows": [
    [
      [
        1969.86,
        176.18
      ],
      [
        1223.94,
        690.895
      ],
      [
        1272.39632332,
        -246.89599901
      ],
      [
        1202.49632332,
        -245.21609901
      ]
    ],
    [
      [
        1971.22315909,
        181.26688999
      ],
      [
        1223.30960809,
        694.00089591
      ],
      [
        1264.72784561,
        -238.8492457
      ],
      [
        1194.82784561,
        -237.1693457
      ]
    ],
    [
      [
        1972.69528606,
        186.76024903
      ],
      [
        1222.58942039,
        697.3881851
      ],
      [
        1256.44291584,
        -230.15563161
      ],
      [
        1186.54291584,
        -228.47573161
      ]
    ],
    [
      [
        1974.28747492,
        192.70197232
      ],
      [
        1221.89231452,
        700.98297061
      ],
      [
        1247.48946004,
        -220.76051399
      ],
      [
        1177.58946004,
        -219.08061399
      ]
    ],
    [
      [
        1976.01148216,
        199.13665925
      ],
      [
        1221.38372965,
        704.66521561
      ],
      [
        1237.8157211,
        -210.60958266
      ],
      [
        1167.9157211,
        -208.92968266
      ]
    ],
    [
      [
        1977.87697725,
        206.10076423
      ],
      [
        1221.05471896,
        708.35905643
      ],
      [
        1227.35552118,
        -199.63339528
      ],
      [
        1157.45552118,
        -197.95349528
      ]
    ],
    [
      [
        1979.90201288,
        213.66148716
      ],
      [
        1220.77790557,
        712.20845454
      ],
      [
        1216.02988534,
        -187.7490812
      ],
      [
        1146.12988534,
        -186.0691812
      ]
    ],
    [
      [
        1982.10739621,
        221.89635657
      ],
      [
        1220.43286719,
        716.45451195
      ],
      [
        1203.78237553,
        -174.89741837
      ],
      [
        1133.88237553,
        -173.21751837
      ]
    ],
    [
      [
        1984.51212232,
        230.87872712
      ],
      [
        1219.98508191,
        721.17904434
      ],
      [
        1190.53077402,
        -160.99213336
      ],
      [
        1120.63077402,
        -159.31223336
      ]
    ],
    [
      [
        1987.1384122,
        240.68625281
      ],
      [
        1219.45239379,
        726.36232137
      ],
      [
        1176.17748069,
        -145.93081157
      ],
      [
        1106.27748069,
        -144.25091157
      ]
    ],
    [
      [
        1990.00248409,
        251.36740743
      ],
      [
        1218.8065991,
        732.03756608
      ],
      [
        1160.70028157,
        -129.55548751
      ],
      [
        1090.80028157,
        -127.87558751
      ]
    ],
    [
      [
        1993.14836384,
        263.09270549
      ],
      [
        1218.03481823,
        738.27598588
      ],
      [
        1143.86367732,
        -111.8672711
      ],
      [
        1073.96367732,
        -110.1873711
      ]
    ],
    [
      [
        1996.70965919,
        276.38817388
      ],
      [
        1217.16887867,
        745.23691853
      ],
      [
        1124.80721036,
        -93.48373662
      ],
      [
        1057.29408346,
        -91.99199461
      ]
    ],
    [
      [
        2000.61115034,
        290.9595657
      ],
      [
        1216.22696718,
        752.76672207
      ],
      [
        1104.20703465,
        -73.48355472
      ],
      [
        1032.49635581,
        -71.69540742
      ]
    ],
    [
      [
        2004.62760857,
        305.94142734
      ],
      [
        1215.3007821,
        760.41278119
      ],
      [
        1083.72789138,
        -49.99543535
      ],
      [
        937.10855324,
        -45.6890757
      ]
    ],
    [
      [
        2009.12053233,
        322.70294846
      ],
      [
        1214.22087849,
        768.88800336
      ],
      [
        1060.98618305,
        -24.93110293
      ],
      [
        824.1741047,
        -16.93254583
      ]
    ],
    [
      [
        2014.18040085,
        341.58980432
      ],
      [
        1212.90812964,
        778.37481112
      ],
      [
        1035.56420481,
        1.64913515
      ],
      [
        706.51525135,
        14.59365003
      ]
    ],
    [
      [
        2019.74975067,
        362.39567737
      ],
      [
        1211.33198637,
        788.79092747
      ],
      [
        1008.07684611,
        30.68592465
      ],
      [
        572.55155882,
        50.48962526
      ]
    ],
    [
      [
        2025.88222831,
        385.27987309
      ],
      [
        1210.25381332,
        799.62410507
      ],
      [
        977.92841137,
        62.05497473
      ],
      [
        420.45924384,
        91.24201016
      ]
    ],
    [
      [
        2032.71705505,
        410.76334387
      ],
      [
        1208.77401591,
        811.71630281
      ],
      [
        945.22303474,
        96.35562345
      ],
      [
        244.51051578,
        138.38872757
      ]
    ],
    [
      [
        2040.31425276,
        439.11541259
      ],
      [
        1207.10712682,
        824.87636409
      ],
      [
        909.60486643,
        133.78170052
      ],
      [
        39.36901942,
        193.3553049
      ]
    ],
    [
      [
        2048.79736402,
        470.78652864
      ],
      [
        1205.30143263,
        839.27492384
      ],
      [
        870.72888596,
        174.61630998
      ],
      [
        -200.92846201,
        258.34555516
      ]
    ],
    [
      [
        2058.30175976,
        506.26896463
      ],
      [
        1203.32879968,
        854.95972417
      ],
      [
        828.2261685,
        219.18622001
      ],
      [
        -330.64486604,
        323.03420905
      ]
    ],
    [
      [
        2068.99490051,
        546.16974034
      ],
      [
        1201.16739507,
        872.08227937
      ],
      [
        781.75300274,
        267.93357004
      ],
      [
        -313.82590122,
        379.03000391
      ]
    ],
    [
      [
        2081.06786785,
        591.22411353
      ],
      [
        1198.84622487,
        890.92843849
      ],
      [
        730.87580133,
        321.34759507
      ],
      [
        -297.46117319,
        440.09784759
      ]
    ],
    [
      [
        2094.79925004,
        642.46153543
      ],
      [
        1196.2636508,
        911.49415655
      ],
      [
        675.06309038,
        379.88482995
      ],
      [
        -279.90881798,
        505.6096404
      ]
    ],
    [
      [
        2109.02770795,
        695.58179866
      ],
      [
        1193.71056272,
        932.1700179
      ],
      [
        619.27625902,
        438.44672896
      ],
      [
        -262.78388713,
        569.51747867
      ]
    ],
    [
      [
        2123.84858193,
        750.88429254
      ],
      [
        1191.06901768,
        952.70230839
      ],
      [
        563.47849703,
        496.99821337
      ],
      [
        -246.11031583,
        631.74452103
      ]
    ],
    [
      [
        2139.2435991,
        808.338605
      ],
      [
        1188.46533385,
        973.3209033
      ],
      [
        507.67553188,
        555.5447389
      ],
      [
        -229.92787331,
        692.14021822
      ]
    ],
    [
      [
        2156.70653767,
        867.09848592
      ],
      [
        1185.84343107,
        993.91602139
      ],
      [
        451.85386348,
        614.07343191
      ],
      [
        -214.25922384,
        750.61659594
      ]
    ],
    [
      [
        1887.97818969,
        954.73555257
      ],
      [
        1183.31220794,
        1014.55522803
      ],
      [
        396.08526789,
        672.65269716
      ],
      [
        -199.1200762,
        807.11108817
      ]
    ],
    [
      [
        1656.15939359,
        1016.63245383
      ],
      [
        1180.71963871,
        1035.15781128
      ],
      [
        340.28546033,
        731.20223214
      ],
      [
        -184.58175182,
        861.37185318
      ]
    ],
    [
      [
        1500.5325526,
        1058.32973966
      ],
      [
        1178.13065063,
        1055.76884628
      ],
      [
        284.48765498,
        789.75367522
      ],
      [
        -170.67006967,
        913.29148352
      ]
    ],
    [
      [
        1389.18145551,
        1088.16608819
      ],
      [
        1175.54160247,
        1076.37657264
      ],
      [
        228.69051787,
        848.30575512
      ],
      [
        -157.4464185,
        962.63811625
      ]
    ]
  ],
  "arrows": [
    {
      "id": "left-fold-flow",
      "vertex": 2,
      "from": [
        1025,
        25
      ],
      "to": [
        330,
        740
      ]
    },
    {
      "id": "valley-flow",
      "vertex": 1,
      "from": [
        1248,
        646
      ],
      "to": [
        1218,
        774
      ]
    }
  ]
}
